{
  "schema": "kiana.reference-repository-registry.v1",
  "version": "1.0",
  "revision_id": "reference-registry-2026-07-15-reviewed",
  "revision_kind": "successor",
  "snapshot_id": "reference-snapshot-2026-07-15-reviewed",
  "frozen_at": "2026-07-17T11:19:16Z",
  "expected_count": 38,
  "repositories": [
    {
      "repo_id": "12-factor-agents",
      "path": "reference/12-factor-agents",
      "upstream": {
        "kind": "git",
        "locator": "https://github.com/humanlayer/12-factor-agents.git"
      },
      "availability": "available",
      "scanned_at": "2026-07-17T11:19:16Z",
      "revision_kind": "git_commit",
      "revision_value": "d20c728368bf9c189d6d7aab704744decb6ec0cc",
      "tree_sha256": "3e440901add919997fa7df3f3f0f171931c1782dfdbd9c92ea3e85023d7740f2",
      "license_sha256": "8dad249648045c09d5405d5e730584ebd3b43fe5018ac4a1970a9598b9d89380",
      "domains": [
        "D10",
        "D17",
        "D18"
      ],
      "inventory_capability_ids": [
        "cap.ref.12-factor-agents.mechanisms",
        "cap.ref.12-factor-agents.boundary"
      ],
      "git_head": "d20c728368bf9c189d6d7aab704744decb6ec0cc",
      "freshness": "current",
      "license_status": "found",
      "license_expression": "Apache-2.0",
      "license_compatibility": "compatible",
      "license_evidence_ids": [
        "ev.license.12-factor-agents.review"
      ],
      "aliases": []
    },
    {
      "repo_id": "archon",
      "path": "reference/Archon",
      "upstream": {
        "kind": "git",
        "locator": "https://github.com/Schr0d/Archon.git"
      },
      "availability": "available",
      "scanned_at": "2026-07-17T11:19:16Z",
      "revision_kind": "git_commit",
      "revision_value": "55ef3bc7bff21d631176dc05e29545582f221505",
      "tree_sha256": "22055002c86f760b75fc66af2d5090f5b74c2e9ae2751fe3f4177e307d0a0676",
      "license_sha256": "fc8f7fa418c6230c04710d75b1817f3c0feb269f7336b1e80b26c485afca2878",
      "domains": [
        "D05"
      ],
      "inventory_capability_ids": [
        "cap.ref.archon.mechanisms",
        "cap.ref.archon.boundary"
      ],
      "git_head": "55ef3bc7bff21d631176dc05e29545582f221505",
      "freshness": "current",
      "license_status": "found",
      "license_expression": "MIT",
      "license_compatibility": "compatible",
      "license_evidence_ids": [
        "ev.license.archon.review"
      ],
      "aliases": [
        {
          "kind": "repo_id",
          "value": "Archon",
          "change_kind": "replaced",
          "reason": "Imported catalog identifier normalized to a stable lowercase repository ID.",
          "effective_at": "2026-07-17T11:19:16Z",
          "evidence_ids": [
            "ev.alias.archon.review"
          ],
          "review_revision": "reference-review-2026-07-17"
        }
      ]
    },
    {
      "repo_id": "ecc",
      "path": "reference/ECC",
      "upstream": {
        "kind": "git",
        "locator": "https://github.com/affaan-m/ECC.git"
      },
      "availability": "available",
      "scanned_at": "2026-07-17T11:19:16Z",
      "revision_kind": "git_commit",
      "revision_value": "38a7ebbe3294be9bfda5612c6d696742ade6fbb2",
      "tree_sha256": "1edf8af79b2a64b46dd1b4037402c4d9379293ae61f346724f405f58f23493d4",
      "license_sha256": "937ca60c8951d39f87631306353bdc301f4e63605dbfc2015d1542fc20757244",
      "domains": [
        "D07"
      ],
      "inventory_capability_ids": [
        "cap.ref.ecc.mechanisms",
        "cap.ref.ecc.boundary"
      ],
      "git_head": "38a7ebbe3294be9bfda5612c6d696742ade6fbb2",
      "freshness": "current",
      "license_status": "found",
      "license_expression": "MIT",
      "license_compatibility": "compatible",
      "license_evidence_ids": [
        "ev.license.ecc.review"
      ],
      "aliases": [
        {
          "kind": "repo_id",
          "value": "ECC",
          "change_kind": "replaced",
          "reason": "Imported catalog identifier normalized to a stable lowercase repository ID.",
          "effective_at": "2026-07-17T11:19:16Z",
          "evidence_ids": [
            "ev.alias.ecc.review"
          ],
          "review_revision": "reference-review-2026-07-17"
        }
      ]
    },
    {
      "repo_id": "gitnexus",
      "path": "reference/GitNexus",
      "upstream": {
        "kind": "git",
        "locator": "https://github.com/abhigyanpatwari/GitNexus.git"
      },
      "availability": "available",
      "scanned_at": "2026-07-17T11:19:16Z",
      "revision_kind": "git_commit",
      "revision_value": "f236be05e0cb77c6d77370bf8bc64885ebaf09d1",
      "tree_sha256": "2067e23505bc8357bf017319a7828144ac7d22b5829ad302f62bf5b9889632b3",
      "license_sha256": "8c352f55fe351be486a9064e57d109301d3738b6c5136c04d37beb33ad41cf0b",
      "domains": [
        "D13"
      ],
      "inventory_capability_ids": [
        "cap.ref.gitnexus.mechanisms",
        "cap.ref.gitnexus.boundary"
      ],
      "git_head": "f236be05e0cb77c6d77370bf8bc64885ebaf09d1",
      "freshness": "current",
      "license_status": "found",
      "license_expression": "PolyForm-Noncommercial-1.0.0",
      "license_compatibility": "incompatible",
      "license_evidence_ids": [
        "ev.license.gitnexus.review"
      ],
      "aliases": [
        {
          "kind": "repo_id",
          "value": "GitNexus",
          "change_kind": "replaced",
          "reason": "Imported catalog identifier normalized to a stable lowercase repository ID.",
          "effective_at": "2026-07-17T11:19:16Z",
          "evidence_ids": [
            "ev.alias.gitnexus.review"
          ],
          "review_revision": "reference-review-2026-07-17"
        }
      ]
    },
    {
      "repo_id": "mempalace",
      "path": "reference/MemPalace",
      "upstream": {
        "kind": "git",
        "locator": "https://github.com/adshaa/mempalacejs.git"
      },
      "availability": "available",
      "scanned_at": "2026-07-17T11:19:16Z",
      "revision_kind": "git_commit",
      "revision_value": "000524b111e78ae56fd858b8c3a74e2a89080091",
      "tree_sha256": "033a8d03db0223c357e9996457887da711b7ddaf5dedf6d07a5df5a5c3528188",
      "license_sha256": "6627ea7e5c5096960233f2424a33f953949bb4f47b9222dcda5e245523aa35eb",
      "domains": [
        "D14"
      ],
      "inventory_capability_ids": [
        "cap.ref.mempalace.mechanisms",
        "cap.ref.mempalace.boundary"
      ],
      "git_head": "000524b111e78ae56fd858b8c3a74e2a89080091",
      "freshness": "current",
      "license_status": "found",
      "license_expression": "ISC",
      "license_compatibility": "compatible",
      "license_evidence_ids": [
        "ev.license.mempalace.review"
      ],
      "aliases": [
        {
          "kind": "repo_id",
          "value": "MemPalace",
          "change_kind": "replaced",
          "reason": "Imported catalog identifier normalized to a stable lowercase repository ID.",
          "effective_at": "2026-07-17T11:19:16Z",
          "evidence_ids": [
            "ev.alias.mempalace.review"
          ],
          "review_revision": "reference-review-2026-07-17"
        }
      ]
    },
    {
      "repo_id": "metagpt",
      "path": "reference/MetaGPT",
      "upstream": {
        "kind": "git",
        "locator": "https://github.com/FoundationAgents/MetaGPT.git"
      },
      "availability": "available",
      "scanned_at": "2026-07-17T11:19:16Z",
      "revision_kind": "git_commit",
      "revision_value": "11cdf466d042aece04fc6cfd13b28e1a70341b1f",
      "tree_sha256": "458f25533252edfba29096a33b9f808c992ef12675d94d73f7931d5cfdbf0e14",
      "license_sha256": "4e6fd8136c0eb122ecb047e325caad3919f8531b5c733022eb62f7393e65a222",
      "domains": [
        "D06",
        "D15"
      ],
      "inventory_capability_ids": [
        "cap.ref.metagpt.mechanisms",
        "cap.ref.metagpt.boundary"
      ],
      "git_head": "11cdf466d042aece04fc6cfd13b28e1a70341b1f",
      "freshness": "current",
      "license_status": "found",
      "license_expression": "MIT",
      "license_compatibility": "compatible",
      "license_evidence_ids": [
        "ev.license.metagpt.review"
      ],
      "aliases": [
        {
          "kind": "repo_id",
          "value": "MetaGPT",
          "change_kind": "replaced",
          "reason": "Imported catalog identifier normalized to a stable lowercase repository ID.",
          "effective_at": "2026-07-17T11:19:16Z",
          "evidence_ids": [
            "ev.alias.metagpt.review"
          ],
          "review_revision": "reference-review-2026-07-17"
        }
      ]
    },
    {
      "repo_id": "openhands",
      "path": "reference/OpenHands",
      "upstream": {
        "kind": "git",
        "locator": "https://github.com/OpenHands/OpenHands.git"
      },
      "availability": "available",
      "scanned_at": "2026-07-17T11:19:16Z",
      "revision_kind": "git_commit",
      "revision_value": "1869baf49914309f2115cd8f75d5c7a57a92b371",
      "tree_sha256": "7c43fbe3d3901ce59aed1c66e475437a3921c1a7b0ed310c5643d937891dc678",
      "license_sha256": "c5e2d9c2df2292dbc46780f48ed288b3066adc0d657255be1f64007b579a2920",
      "domains": [
        "D03",
        "D10",
        "D12",
        "D15",
        "D16",
        "D17",
        "D18"
      ],
      "inventory_capability_ids": [
        "cap.ref.openhands.mechanisms",
        "cap.ref.openhands.boundary"
      ],
      "git_head": "1869baf49914309f2115cd8f75d5c7a57a92b371",
      "freshness": "current",
      "license_status": "conflicting",
      "license_expression": "MIT AND LicenseRef-OpenHands-Enterprise",
      "license_compatibility": "review_required",
      "license_evidence_ids": [
        "ev.license.openhands.review"
      ],
      "aliases": [
        {
          "kind": "repo_id",
          "value": "OpenHands",
          "change_kind": "replaced",
          "reason": "Imported catalog identifier normalized to a stable lowercase repository ID.",